{
    "$schema": "http://json-schema.org/draft-07/schema#",
    "title": "Graph Data",
    "description": "Schema for graph traversal input data",
    "type": "object",
    "required": ["vertices", "edges"],
    "properties": {
      "vertices": {
        "type": "array",
        "description": "List of all vertices in the graph",
        "items": {
          "type": "string",
          "description": "Vertex identifier"
        }
      },
      "edges": {
        "type": "array",
        "description": "List of all edges in the graph",
        "items": {
          "type": "object",
          "required": ["source", "target"],
          "properties": {
            "source": {
              "type": "string",
              "description": "Source vertex of the edge"
            },
            "target": {
              "type": "string",
              "description": "Target vertex of the edge"
            },
            "weight": {
              "type": "number",
              "description": "Weight of the edge (optional)",
              "minimum": 0
            },
            "directed": {
              "type": "boolean",
              "description": "Whether the edge is directed (optional, default: false)"
            }
          }
        }
      },
      "isDirected": {
        "type": "boolean",
        "description": "Whether the graph is directed (optional, default: false)"
      },
      "metadata": {
        "type": "object",
        "description": "Additional metadata about the graph (optional)",
        "properties": {
          "name": {
            "type": "string",
            "description": "Name of the graph"
          },
          "description": {
            "type": "string",
            "description": "Description of the graph"
          }
        }
      }
    }
  }
  